{
  "id": "anthropic-docx",
  "name": "Anthropic DOCX",
  "source": "anthropics/skills/docx",
  "origin": "Anthropic 官方",
  "category": "文档办公",
  "creator": "Anthropic",
  "workflow": "Word 文档读写",
  "installType": "官方 GitHub skill",
  "status": "官方来源",
  "quality": "官方文档 skill",
  "description": "用于创建、读取、编辑和排版 Word 文档，覆盖目录、页眉页脚、表格和专业文档格式。",
  "bestFor": [
    "需要生成正式 Word 报告、申请书或说明文档",
    "修改已有 DOCX 的结构、样式、表格或页面元素",
    "把结构化内容整理成可继续编辑的 Word 文件"
  ],
  "avoidWhen": [
    "只需要纯 Markdown 文本",
    "目标是排版极复杂的出版社级模板且缺少原模板"
  ],
  "verification": [
    "生成后能用 Word 或兼容工具打开",
    "目录、标题层级、表格和页眉页脚保持可编辑",
    "关键字段、页数和格式在导出后抽样核验"
  ],
  "install": "git clone https://github.com/anthropics/skills.git ~/.codex/anthropic-skills && cp -R ~/.codex/anthropic-skills/skills/docx ~/.agents/skills/docx",
  "repo": "https://github.com/anthropics/skills/tree/main/skills/docx",
  "tags": [
    "DOCX",
    "Word",
    "文档",
    "官方"
  ]
}
